<?xml version="1.0" encoding="UTF-8"?>
<!DOCTYPE Assets SYSTEM "../dtd/assets.dtd">

<Assets mainSWFSrc="main.swf">
	
	<Labels>
		<Label id="Header.title">www.uliheckmann.com</Label>
		<Label id="Header.sound.on">Sound on</Label>
		<Label id="Header.sound.off">Sound off</Label>
		<Label id="Header.menu">Home</Label>
		<Label id="Header.slideshow">Slideshow</Label>
		<Label id="Credits.design">Design</Label>
		
		<Label id="Loading.loading">Loading</Label>
		<Label id="Loading.data">Data</Label>
		<Label id="Loading.image">Image</Label>
		<Label id="Loading.thumbnails">Thumbnails</Label>

		<Label id="Setting.Letter.Scale">1.2</Label>
		<Label id="Setting.Letter.Spacing">10</Label>
		<Label id="Setting.Letter.Line.Spacing">10</Label>
		<Label id="Setting.Letter.Space.Width">45</Label>
		<Label id="Setting.NavigationPositioning.Enable">false</Label>
	</Labels>
	
	<Links>
		<Link id="Credits.lessrain" href="http://www.lessrain.com">Less Rain</Link>
	</Links>
	
	<Sources>
		<Source id="Navigation" src="../../data/en/navigation.xml?v=14" />
		<Source id="Gallery.Portfolio.Cars" src="http://www.uliheckmann.com/dynamicdata/cars.xml" />
		<Source id="Gallery.Portfolio.People" src="http://www.uliheckmann.com/dynamicdata/people.xml" />
		<Source id="Gallery.Portfolio.Moods" src="http://www.uliheckmann.com/dynamicdata/moods.xml" />
		<Source id="Gallery.Archive.Cars" src="http://www.uliheckmann.com/dynamicdata/archivecars.xml" />
		<Source id="Gallery.Archive.People" src="http://www.uliheckmann.com/dynamicdata/archivepeople.xml" />
		<Source id="Clients" src="http://www.uliheckmann.com/dynamicdata/clients.xml" />
		<Source id="Contact" src="../../data/en/contact.xml" />
		<Source id="Soundtrack" src="../../media/soundtrack32.mp3" />
	</Sources>
	
	<Fonts>
		<Font id="HaasUnica" fontSrc="../fonts/haasunica.swf" importSrc="../fonts/haasunica_import.swf" />
		<Font id="DINEngschrift" fontSrc="../fonts/dinengschrift.swf" importSrc="../fonts/dinengschrift_import.swf" />
	</Fonts>
	
	<StyleSheets>
		<StyleSheet id="main" src="../../css/western.css?v=14" />
	</StyleSheets>
	
	<Images>
		<Image id="fill.main" src="../../media/menu_fill_main_16.jpg" />
		<Image id="fill.cars" src="../../media/menu_fill_portfolio_cars.jpg" />
		<Image id="fill.people" src="../../media/menu_fill_portfolio_people.jpg" />
		<Image id="fill.moods" src="../../media/menu_fill_portfolio_moods.jpg" />
		<Image id="fill.cars.archive" src="../../media/menu_fill_archive_cars.jpg" />
		<Image id="fill.people.archive" src="../../media/menu_fill_archive_people.jpg" />
		<Image id="fill.clients" src="../../media/menu_fill_clients.jpg" />
		<Image id="fill.contact" src="../../media/menu_fill_contact.jpg" />
	</Images>
	
</Assets>
